"Email Config","Email Config"
"Apply For Customer Groups","Apply For Customer Groups"
"New Company Account","New Company Account"
"Be Remove Company Account","Be Remove Company Account"
"Sub User Invitation","Sub User Invitation"
"Joined Sub User Notification","Joined Sub User Notification"
"If you are a company representative, use this feature to be able to manage subaccounts and other B2B features.","If you are a company representative, use this feature to be able to manage subaccounts and other B2B features."

